{
    "id": "1",
    "firstName": "Aris",
    "lastName": "Saputra",
    "age": 24,
    "occupation": "karyawan",
    "nationality": "Indonesia",
    "hobbies": [
        "Manga", "Sales", "Selling", "tawuran"
    ],
    "gender": "MALE",
    "createdDate": "2022-11-26T03:04:09.638Z",
    "updatedDate": "2022-11-26T03:04:09.638Z"
}